organisation,repo_name,repository_link,programming_languages,description
shopify,shopify-python-api,https://github.com/Shopify/shopify_python_api,Python,ShopifyAPI library allows Python developers to programmatically access the admin section
bigcommerce,bigcommerce-api-python,https://github.com/bigcommerce/bigcommerce-api-python,Python,BigCommerce API client for Python
woocommerce,wc-api-python,https://github.com/woocommerce/wc-api-python,Python,Python wrapper for the WooCommerce REST API
magento,magento-python,https://github.com/magento/magento2-python,Python,Magento 2 Python integration
square,connect-python-sdk,https://github.com/square/connect-python-sdk,Python,Python client library for the Square Connect APIs
coursera,coursera-dl,https://github.com/coursera-dl/coursera-dl,Python,Script for downloading Coursera.org videos and naming them
udacity,udacity-python,https://github.com/udacity/deep-learning-v2-pytorch,Python,Projects and exercises for the Deep Learning Nanodegree programs
edx,configuration,https://github.com/edx/configuration,Python,A collection of edx configuration scripts and utilities
khanacademy,khan-api,https://github.com/Khan/khan-api,Python,Khan Academy API Python wrapper
facebook,facebook-python-business-sdk,https://github.com/facebook/facebook-python-business-sdk,Python,Python SDK for Facebook Business APIs
google-ads,google-ads-python,https://github.com/googleads/google-ads-python,Python,Google Ads API Client Library for Python
twitter,twitter-api-python-sdk,https://github.com/twitterdev/twitter-api-python-sdk,Python,A Python SDK for the Twitter API
linkedin,python-linkedin-v2,https://github.com/ozgur/python-linkedin,Python,Python interface to the LinkedIn API
pinterest,pinterest-python-sdk,https://github.com/pinterest/api-quickstart,Python,Pinterest API quickstart
netflix,flamescope,https://github.com/Netflix/flamescope,Python,FlameScope is a visualization tool for exploring different time ranges
spotify,chartify,https://github.com/spotify/chartify,Python,Python library that makes it easy for data scientists to create charts
twitch,twitch-python,https://github.com/PythonTwitchBotFramework/PythonTwitchBotFramework,Python,Python Twitch Bot Framework
youtube,youtube-data-api,https://github.com/mabrownnyu/youtube-data-api,Python,YouTube Data API Python wrapper
soundcloud,soundcloud-python,https://github.com/soundcloud/soundcloud-python,Python,A Python wrapper around the SoundCloud API
consensys,py-evm,https://github.com/ethereum/py-evm,Python,A Python implementation of the Ethereum Virtual Machine
chainhq,web3.py,https://github.com/ethereum/web3.py,Python,A python interface for interacting with the Ethereum blockchain
binance,python-binance,https://github.com/sammchardy/python-binance,Python,Binance Exchange API python implementation
coinbase,coinbase-pro-python,https://github.com/danpaquin/coinbasepro-python,Python,The unofficial Python client for the Coinbase Pro API
kraken,krakenex,https://github.com/veox/python3-krakenex,Python,Python 3 package for Kraken.com cryptocurrency exchange API
bitfinex,bitfinex-api-py,https://github.com/bitfinexcom/bitfinex-api-py,Python,Official Bitfinex Python API
verizon,verizon-python,https://github.com/verizon/verizon-python,Python,Verizon Python SDK
att,att-python,https://github.com/attdevsupport/python-sdk,Python,AT&T Python SDK
vonage,vonage-python-sdk,https://github.com/Vonage/vonage-python-sdk,Python,Vonage Server SDK for Python
bandwidth,python-bandwidth,https://github.com/Bandwidth/python-bandwidth,Python,Bandwidth Python API
weatherapi,python-weather-api,https://github.com/chubin/wttr.in,Python,The right way to check the weather
openweathermap,pyowm,https://github.com/csparpa/pyowm,Python,A Python wrapper around OpenWeatherMap web APIs
climacell,climacell-python,https://github.com/climacell/climacell-python,Python,ClimaCell API Python SDK
weatherbit,weatherbit-python,https://github.com/weatherbit/weatherbit-python,Python,Python library for the Weatherbit API
cropio,cropio-python,https://github.com/cropio/cropio-python,Python,Crop.io Python SDK
farmlog,farmlog-python,https://github.com/farmlogicllc/farmlog-python,Python,FarmLog Python API
climate,climate-python,https://github.com/ClimateCorporation/climate-python,Python,Climate Corporation Python SDK
transferwise,transferwise-python,https://github.com/transferwise/transferwise-python,Python,Wise (formerly TransferWise) Python API
remitly,remitly-python,https://github.com/remitly/remitly-python,Python,Remitly Python SDK
western-union,wu-python,https://github.com/westernunion/western-union-python,Python,Western Union Python SDK
zapier,zapier-platform-python,https://github.com/zapier/zapier-platform-python,Python,Zapier Platform Python SDK
ifttt,ifttt-python,https://github.com/ifttt/ifttt-python,Python,IFTTT Python SDK
airtable,airtable-python-wrapper,https://github.com/gtalarico/airtable-python-wrapper,Python,Python API wrapper for the Airtable API
notion,notion-sdk-py,https://github.com/ramnes/notion-sdk-py,Python,Python SDK for the official Notion API
dropbox,dropbox-sdk-python,https://github.com/dropbox/dropbox-sdk-python,Python,Official Dropbox API Client
box,box-python-sdk,https://github.com/box/box-python-sdk,Python,Box SDK for Python
github,PyGithub,https://github.com/PyGithub/PyGithub,Python,Typed interactions with the GitHub API v3
gitlab,python-gitlab,https://github.com/python-gitlab/python-gitlab,Python,A python wrapper for the GitLab API
atlassian,atlassian-python-api,https://github.com/atlassian-api/atlassian-python-api,Python,Atlassian Python API wrapper
jira,jira-python,https://github.com/pycontribs/jira,Python,Python JIRA library
confluence,confluence-python,https://github.com/atlassian-api/atlassian-python-api,Python,Confluence Python API
slack,python-slack-sdk,https://github.com/slackapi/python-slack-sdk,Python,Slack SDK for Python
discord,discord.py,https://github.com/Rapptz/discord.py,Python,An API wrapper for Discord written in Python
telegram,python-telegram-bot,https://github.com/python-telegram-bot/python-telegram-bot,Python,We have made you a wrapper you can't refuse
whatsapp,whatsapp-python,https://github.com/tgalal/yowsup,Python,The WhatsApp lib
signal,signal-cli-rest-api,https://github.com/bbernhard/signal-cli-rest-api,Python,Signal CLI REST API
zoom,zoomus,https://github.com/prschmid/zoomus,Python,Python wrapper around the Zoom.us REST API
teams,pymsteams,https://github.com/rveachkc/pymsteams,Python,Python Wrapper Library to send Microsoft Teams webhooks
elasticsearch,elasticsearch-py,https://github.com/elastic/elasticsearch-py,Python,Official Python low-level client for Elasticsearch
mongodb,pymongo,https://github.com/mongodb/mongo-python-driver,Python,PyMongo - the Official MongoDB Python driver
cassandra,python-driver,https://github.com/datastax/python-driver,Python,DataStax Python Driver for Apache Cassandra
redis,redis-py,https://github.com/redis/redis-py,Python,Redis Python client
influxdata,influxdb-python,https://github.com/influxdata/influxdb-python,Python,Python client for InfluxDB
prometheus,client_python,https://github.com/prometheus/client_python,Python,Prometheus instrumentation library for Python applications
grafana,grafana-api-python-client,https://github.com/m0nhawk/grafana_api,Python,Grafana API Python client
datadog,datadogpy,https://github.com/DataDog/datadogpy,Python,The Datadog Python library
newrelic,newrelic-python-agent,https://github.com/newrelic/newrelic-python-agent,Python,New Relic Python agent
honeycomb,honeycomb-python,https://github.com/honeycombio/libhoney-py,Python,Python library for sending data to Honeycomb
bugsnag,bugsnag-python,https://github.com/bugsnag/bugsnag-python,Python,Python notifier for Bugsnag
rollbar,pyrollbar,https://github.com/rollbar/pyrollbar,Python,Error tracking and logging from Python to Rollbar
sentry,sentry-python,https://github.com/getsentry/sentry-python,Python,The official Python SDK for Sentry
logentries,le_python,https://github.com/logentries/le_python,Python,Logentries Python library
loggly,loggly-python,https://github.com/loggly/loggly-python,Python,Loggly Python library
papertrail,papertrail-python,https://github.com/papertrail/papertrail-python,Python,Papertrail Python library
segment,analytics-python,https://github.com/segmentio/analytics-python,Python,The hassle-free way to integrate analytics into any Python application
mixpanel,mixpanel-python,https://github.com/mixpanel/mixpanel-python,Python,Official Mixpanel Python library
amplitude,amplitude-python,https://github.com/amplitude/amplitude-python,Python,Official Amplitude Python SDK
heap,heap-python,https://github.com/heap/heap-python-sdk,Python,Heap Python SDK
fullstory,fullstory-python,https://github.com/fullstorydev/fullstory-python-sdk,Python,FullStory Python SDK
hotjar,hotjar-python,https://github.com/hotjar/hotjar-python,Python,Hotjar Python SDK
intercom,python-intercom,https://github.com/intercom/python-intercom,Python,Intercom Python SDK
zendesk,zendesk_sdk_python,https://github.com/zendesk/zendesk_sdk_python,Python,Zendesk Python SDK
freshworks,freshworks-python,https://github.com/freshworks/freshworks-python-sdk,Python,Freshworks Python SDK
hubspot,hubspot-api-python,https://github.com/HubSpot/hubspot-api-python,Python,HubSpot API Python SDK
salesforce,simple-salesforce,https://github.com/simple-salesforce/simple-salesforce,Python,A very simple Salesforce.com REST API client for Python
pipedrive,pipedrive-python-lib,https://github.com/pipedrive/pipedrive-python-lib,Python,Pipedrive Python library
close,closeio-api,https://github.com/closeio/closeio-api,Python,Python client for Close API
calendly,calendly-python,https://github.com/calendly/calendly-python,Python,Calendly Python SDK
