organisation,repo_name,repository_link,programming_languages,description
huggingface,transformers,https://github.com/huggingface/transformers,"Python, CUDA","🤗 Transformers: State-of-the-art Machine Learning for Pytorch, TensorFlow, and JAX"
openai,openai-python,https://github.com/openai/openai-python,Python,The official Python library for the OpenAI API
openai,openai-agents-python,https://github.com/openai/openai-agents-python,Python,"A lightweight, powerful framework for multi-agent workflows"
microsoft,markitdown,https://github.com/microsoft/markitdown,Python,Python tool for converting files and office documents to Markdown
microsoft,qlib,https://github.com/microsoft/qlib,Python,AI-oriented Quant investment platform using AI tech to empower Quant Research
microsoft,nni,https://github.com/microsoft/nni,"Python, TypeScript",An open source AutoML toolkit for automate machine learning lifecycle
microsoft,playwright-python,https://github.com/microsoft/playwright-python,Python,Python version of the Playwright testing and automation library
microsoft,pyright,https://github.com/microsoft/pyright,"Python, TypeScript",Static Type Checker for Python
google,python-fire,https://github.com/google/python-fire,Python,Python Fire is a library for automatically generating command line interfaces
google,yapf,https://github.com/google/yapf,Python,A formatter for Python files
ray-project,ray,https://github.com/ray-project/ray,"Python, C++",Ray is an AI compute engine. Ray consists of a core distributed runtime and AI Libraries
netflix,conductor,https://github.com/Netflix/conductor,"Java, Python",Conductor is a microservices orchestration engine
spotify,luigi,https://github.com/spotify/luigi,Python,Luigi is a Python module that helps you build complex pipelines of batch jobs
deezer,spleeter,https://github.com/deezer/spleeter,Python,Deezer source separation library including pretrained models
quantopian,zipline,https://github.com/quantopian/zipline,Python,"Zipline, a Pythonic Algorithmic Trading Library"
freqtrade,freqtrade,https://github.com/freqtrade/freqtrade,Python,"Free, open source crypto trading bot"
hummingbot,hummingbot,https://github.com/hummingbot/hummingbot,Python,Open source software that helps you create and deploy high-frequency crypto trading bots
ccxt,ccxt,https://github.com/ccxt/ccxt,"JavaScript, TypeScript, Python, C#, PHP",A cryptocurrency trading API with support for more than 100 bitcoin/altcoin exchanges
vnpy,vnpy,https://github.com/vnpy/vnpy,Python,基于Python的开源量化交易平台开发框架
bbfamily,abu,https://github.com/bbfamily/abu,Python,阿布量化交易系统(股票，期权，期货，比特币，机器学习) 基于python的开源量化交易
akfamily,akshare,https://github.com/akfamily/akshare,Python,AKShare is an elegant and simple financial data interface library for Python
waditu,tushare,https://github.com/waditu/tushare,Python,TuShare is a utility for crawling historical data of China stocks
ranaroussi,yfinance,https://github.com/ranaroussi/yfinance,Python,Download market data from Yahoo! Finance's API
mementum,backtrader,https://github.com/mementum/backtrader,Python,Python Backtesting library for trading strategies
OpenBB-finance,OpenBB,https://github.com/OpenBB-finance/OpenBB,Python,"Investment Research for Everyone, Everywhere"
odoo,odoo,https://github.com/odoo/odoo,"Python, JavaScript",Odoo. Open Source Apps To Grow Your Business
saleor,saleor,https://github.com/saleor/saleor,"Python, TypeScript","Saleor Core: the high performance, composable, headless commerce API"
frappe,erpnext,https://github.com/frappe/erpnext,"Python, JavaScript",Free and Open Source Enterprise Resource Planning (ERP)
getsentry,sentry,https://github.com/getsentry/sentry,"Python, TypeScript",Developer-first error tracking and performance monitoring
ansible,ansible,https://github.com/ansible/ansible,Python,Ansible is a radically simple IT automation platform
ansible,awx,https://github.com/ansible/awx,"Python, JavaScript","AWX provides a web-based user interface, REST API, and task engine built on top of Ansible"
saltstack,salt,https://github.com/saltstack/salt,Python,Software to automate the management and configuration of infrastructure and applications at scale
fail2ban,fail2ban,https://github.com/fail2ban/fail2ban,Python,Daemon to ban hosts that cause multiple authentication errors
jumpserver,jumpserver,https://github.com/jumpserver/jumpserver,"Python, JavaScript",JumpServer is an open-source Privileged Access Management (PAM) tool
prowler-cloud,prowler,https://github.com/prowler-cloud/prowler,Python,"Prowler is the Open Cloud Security platform for AWS, Azure, GCP, Kubernetes, M365"
localstack,localstack,https://github.com/localstack/localstack,Python,💻 A fully functional local AWS cloud stack. Develop and test your cloud & Serverless apps offline
apache,airflow,https://github.com/apache/airflow,Python,"Apache Airflow - A platform to programmatically author, schedule, and monitor workflows"
apache,superset,https://github.com/apache/superset,"TypeScript, Python",Apache Superset is a Data Visualization and Data Exploration Platform
dagster-io,dagster,https://github.com/dagster-io/dagster,Python,"An orchestration platform for the development, production, and observation of data assets"
prefecthq,prefect,https://github.com/PrefectHQ/prefect,Python,Prefect is a workflow orchestration framework for building resilient data pipelines in Python
airbytehq,airbyte,https://github.com/airbytehq/airbyte,"Java, Python",The leading data integration platform for ETL / ELT data pipelines
streamlit,streamlit,https://github.com/streamlit/streamlit,Python,Streamlit — A faster way to build and share data apps
plotly,dash,https://github.com/plotly/dash,Python,Data Apps & Dashboards for Python. No JavaScript Required
plotly,plotly.py,https://github.com/plotly/plotly.py,Python,The interactive graphing library for Python
pandas-dev,pandas,https://github.com/pandas-dev/pandas,"Python, C",Flexible and powerful data analysis / manipulation library for Python
numpy,numpy,https://github.com/numpy/numpy,"Python, C",The fundamental package for scientific computing with Python
scipy,scipy,https://github.com/scipy/scipy,"Python, C",SciPy library main repository
scikit-learn,scikit-learn,https://github.com/scikit-learn/scikit-learn,"Python, C++",scikit-learn: machine learning in Python
uber,h3-py,https://github.com/uber/h3-py,"Python, C","Python bindings for H3, a hierarchical hexagonal geospatial indexing system"
uber,ludwig,https://github.com/uber/ludwig,Python,Ludwig is a declarative machine learning framework
pyhealth,PyHealth,https://github.com/sunlabuiuc/PyHealth,Python,A Deep Learning Python Toolkit for supporting clinical predictive modeling
scikit-bio,scikit-bio,https://github.com/scikit-bio/scikit-bio,Python,A community-driven Python library for bioinformatics
python-telegram-bot,python-telegram-bot,https://github.com/python-telegram-bot/python-telegram-bot,Python,We have made you a wrapper you can't refuse
matrix-org,synapse,https://github.com/matrix-org/synapse,Python,Synapse: Matrix homeserver written in Python/Twisted
zulip,zulip,https://github.com/zulip/zulip,"Python, TypeScript",Zulip server and web application. Open-source team chat
fastapi,fastapi,https://github.com/fastapi/fastapi,Python,"FastAPI framework, high performance, easy to learn, fast to code, ready for production"
fastapi,typer,https://github.com/fastapi/typer,Python,"Typer, build great CLIs. Easy to code. Based on Python type hints"
fastapi,sqlmodel,https://github.com/fastapi/sqlmodel,Python,"SQL databases in Python, designed for simplicity, compatibility, and robustness"
django,django,https://github.com/django/django,Python,The Web framework for perfectionists with deadlines
pallets,flask,https://github.com/pallets/flask,Python,The Python micro framework for building web applications
pallets,click,https://github.com/pallets/click,Python,Python composable command line interface toolkit
pallets,jinja,https://github.com/pallets/jinja,Python,A very fast and expressive template engine
encode,django-rest-framework,https://github.com/encode/django-rest-framework,Python,Web APIs for Django. 🎸
encode,httpx,https://github.com/encode/httpx,Python,A next generation HTTP client for Python
encode,starlette,https://github.com/encode/starlette,Python,The little ASGI framework that shines
sanic-org,sanic,https://github.com/sanic-org/sanic,Python,Accelerate your web app development | Build fast. Run fast
tornadoweb,tornado,https://github.com/tornadoweb/tornado,Python,Tornado is a Python web framework and asynchronous networking library
reflex-dev,reflex,https://github.com/reflex-dev/reflex,Python,🕸️ Web apps in pure Python 🐍
ethereum,web3.py,https://github.com/ethereum/web3.py,Python,A python interface for interacting with the Ethereum blockchain and ecosystem
Chia-Network,chia-blockchain,https://github.com/Chia-Network/chia-blockchain,Python,"Chia blockchain python implementation (full node, farmer, harvester, timelord, and wallet)"
os-climate,python-template-repository,https://github.com/os-climate/python-template-repository,Python,Python Template Repository for OS-Climate projects
climatiq,python-oem-data-sdk,https://github.com/climatiq/python-oem-data-sdk,Python,Python SDK for accessing Climatiq OEM Data
home-assistant,core,https://github.com/home-assistant/core,Python,🏡 Open source home automation that puts local control and privacy first
d2l-ai,d2l-zh,https://github.com/d2l-ai/d2l-zh,Python,《动手学深度学习》：面向中文读者、能运行、可讨论
d2l-ai,d2l-en,https://github.com/d2l-ai/d2l-en,Python,"Interactive deep learning book with multi-framework code, math, and discussions"
donnemartin,system-design-primer,https://github.com/donnemartin/system-design-primer,Python,Learn how to design large-scale systems. Prep for the system design interview
donnemartin,interactive-coding-challenges,https://github.com/donnemartin/interactive-coding-challenges,Python,120+ interactive Python coding interview challenges (algorithms and data structures)
donnemartin,data-science-ipython-notebooks,https://github.com/donnemartin/data-science-ipython-notebooks,Python,"Data science Python notebooks: Deep learning, scikit-learn, Kaggle, big data"
3b1b,manim,https://github.com/3b1b/manim,Python,Animation engine for explanatory math videos
ManimCommunity,manim,https://github.com/ManimCommunity/manim,Python,A community-maintained Python framework for creating mathematical animations
TheAlgorithms,Python,https://github.com/TheAlgorithms/Python,Python,All Algorithms implemented in Python
Asabeneh,30-Days-Of-Python,https://github.com/Asabeneh/30-Days-Of-Python,Python,30 days of Python programming challenge is a step-by-step guide to learn Python
geekcomputers,Python,https://github.com/geekcomputers/Python,Python,My Python Examples
trekhleb,learn-python,https://github.com/trekhleb/learn-python,Python,📚 Playground and cheatsheet for learning Python
mouredev,Hello-Python,https://github.com/mouredev/Hello-Python,Python,Curso para aprender el lenguaje de programación Python desde cero
dabeaz-course,python-mastery,https://github.com/dabeaz-course/python-mastery,Python,Advanced Python Mastery (course by @dabeaz)
dabeaz-course,practical-python,https://github.com/dabeaz-course/practical-python,Python,Practical Python Programming (course by @dabeaz)
chiphuyen,stanford-tensorflow-tutorials,https://github.com/chiphuyen/stanford-tensorflow-tutorials,Python,This repository contains code examples for the Stanford's course: TensorFlow for Deep Learning Research
Yorko,mlcourse.ai,https://github.com/Yorko/mlcourse.ai,Python,Open Machine Learning Course
psf,requests,https://github.com/psf/requests,Python,"A simple, yet elegant, HTTP library"
psf,black,https://github.com/psf/black,Python,The uncompromising Python code formatter
python-poetry,poetry,https://github.com/python-poetry/poetry,Python,Python packaging and dependency management made easy
pypa,pipenv,https://github.com/pypa/pipenv,Python,Python Development Workflow for Humans
pypa,pip,https://github.com/pypa/pip,Python,The Python package installer
pypa,pipx,https://github.com/pypa/pipx,Python,Install and Run Python Applications in Isolated Environments
pre-commit,pre-commit,https://github.com/pre-commit/pre-commit,Python,A framework for managing and maintaining multi-language pre-commit hooks
Textualize,rich,https://github.com/Textualize/rich,Python,Rich is a Python library for rich text and beautiful formatting in the terminal
Textualize,textual,https://github.com/Textualize/textual,Python,The lean application framework for Python. Build sophisticated user interfaces
tqdm,tqdm,https://github.com/tqdm/tqdm,Python,"⚡ A Fast, Extensible Progress Bar for Python and CLI"
Delgan,loguru,https://github.com/Delgan/loguru,Python,Python logging made (stupidly) simple
ultralytics,ultralytics,https://github.com/ultralytics/ultralytics,Python,Ultralytics YOLO11 🚀
roboflow,supervision,https://github.com/roboflow/supervision,Python,We write your reusable computer vision tools. 💜
ageitgey,face_recognition,https://github.com/ageitgey/face_recognition,Python,The world's simplest facial recognition api for Python and the command line
JaidedAI,EasyOCR,https://github.com/JaidedAI/EasyOCR,Python,Ready-to-use OCR with 80+ supported languages and all popular writing scripts
ocrmypdf,OCRmyPDF,https://github.com/ocrmypdf/OCRmyPDF,Python,"OCRmyPDF adds an OCR text layer to scanned PDF files, allowing them to be searched"
python-pillow,Pillow,https://github.com/python-pillow/Pillow,Python,Python Imaging Library (Fork)
serengil,deepface,https://github.com/serengil/deepface,Python,A Lightweight Face Recognition and Facial Attribute Analysis Library for Python
danielgatis,rembg,https://github.com/danielgatis/rembg,Python,Rembg is a tool to remove images background
kornia,kornia,https://github.com/kornia/kornia,Python,🐍 Geometric Computer Vision Library for Spatial AI
albumentations-team,albumentations,https://github.com/albumentations-team/albumentations,Python,Fast and flexible image augmentation library
wkentaro,labelme,https://github.com/wkentaro/labelme,Python,"Image Polygonal Annotation with Python (polygon, rectangle, circle, line, point)"
lukas-blecher,LaTeX-OCR,https://github.com/lukas-blecher/LaTeX-OCR,Python,pix2tex: Using a ViT to convert images of equations into LaTeX code
opendatalab,MinerU,https://github.com/opendatalab/MinerU,Python,A high-quality tool for convert PDF to Markdown and JSON
Zulko,moviepy,https://github.com/Zulko/moviepy,Python,Video editing with Python
x-hw,amazing-qr,https://github.com/x-hw/amazing-qr,Python,💮 amazing QRCode generator in Python (supporting animated gif)
amueller,word_cloud,https://github.com/amueller/word_cloud,Python,A little word cloud generator in Python
coqui-ai,TTS,https://github.com/coqui-ai/TTS,Python,"🐸💬 - a deep learning toolkit for Text-to-Speech, battle-tested in research and production"
CorentinJ,Real-Time-Voice-Cloning,https://github.com/CorentinJ/Real-Time-Voice-Cloning,Python,Clone a voice in 5 seconds to generate arbitrary speech in real-time
2noise,ChatTTS,https://github.com/2noise/ChatTTS,Python,A generative speech model for daily dialogue
FunAudioLLM,CosyVoice,https://github.com/FunAudioLLM/CosyVoice,Python,"Multi-lingual large voice generation model, providing inference, training and deployment"
kivy,kivy,https://github.com/kivy/kivy,"Python, C","Open source UI framework written in Python, running on Windows, Linux, macOS, Android and iOS"
pygame,pygame,https://github.com/pygame/pygame,"Python, C",pygame (the library) is a Free and Open Source python programming language library
panda3d,panda3d,https://github.com/panda3d/panda3d,"Python, C++","Powerful, mature open-source cross-platform game engine for Python and C++"
SFTtech,openage,https://github.com/SFTtech/openage,"Python, C++",Clone of the Age of Empires II engine 🚀
AtsushiSakai,PythonRobotics,https://github.com/AtsushiSakai/PythonRobotics,Python,Python sample codes and textbook for robotics algorithms
robotframework,robotframework,https://github.com/robotframework/robotframework,Python,Generic automation framework for acceptance testing and RPA
asweigart,pyautogui,https://github.com/asweigart/pyautogui,Python,A cross-platform GUI automation Python module for human beings
chriskiehl,Gooey,https://github.com/chriskiehl/Gooey,Python,Turn (almost) any Python command line program into a full GUI application with one line
TomSchimansky,CustomTkinter,https://github.com/TomSchimansky/CustomTkinter,Python,A modern and customizable python UI-library based on Tkinter
PySimpleGUI,PySimpleGUI,https://github.com/PySimpleGUI/PySimpleGUI,Python,Python GUIs for Humans! PySimpleGUI is the top-rated Python application development environment
ParthJadhav,Tkinter-Designer,https://github.com/ParthJadhav/Tkinter-Designer,Python,An easy and fast way to create a Python GUI 🐍
zauberzeug,nicegui,https://github.com/zauberzeug/nicegui,Python,Create web-based user interfaces with Python. The nice way
explosion,spaCy,https://github.com/explosion/spaCy,"Python, Cython",💫 Industrial-strength Natural Language Processing (NLP) in Python
nltk,nltk,https://github.com/nltk/nltk,Python,NLTK Source
piskvorky,gensim,https://github.com/piskvorky/gensim,Python,Topic Modelling for Humans
flairNLP,flair,https://github.com/flairNLP/flair,Python,A very simple framework for state-of-the-art Natural Language Processing (NLP)
fighting41love,funNLP,https://github.com/fighting41love/funNLP,Python,中英文敏感词、语言检测、中外手机/电话归属地/运营商查询、名字推断性别等工具
gunthercox,ChatterBot,https://github.com/gunthercox/ChatterBot,Python,"ChatterBot is a machine learning, conversational dialog engine for creating chat bots"
neuml,txtai,https://github.com/neuml/txtai,Python,"💡 All-in-one open-source AI framework for semantic search, LLM orchestration"
567-labs,instructor,https://github.com/567-labs/instructor,Python,structured outputs for llms
langchain-ai,langchain,https://github.com/langchain-ai/langchain,Python,Build context-aware reasoning applications
BerriAI,litellm,https://github.com/BerriAI/litellm,Python,"Python SDK, Proxy Server (LLM Gateway) to call 100+ LLM APIs in OpenAI format"
mem0ai,mem0,https://github.com/mem0ai/mem0,Python,Memory for AI Agents; SOTA in AI Agent Memory
Shubhamsaboo,awesome-llm-apps,https://github.com/Shubhamsaboo/awesome-llm-apps,Python,"Collection of awesome LLM apps with AI Agents and RAG using OpenAI, Anthropic, Gemini"
ollama,ollama-python,https://github.com/ollama/ollama-python,Python,Ollama Python library
gradio-app,gradio,https://github.com/gradio-app/gradio,Python,"Build and share delightful machine learning apps, all in Python"
ComposioHQ,composio,https://github.com/ComposioHQ/composio,Python,Composio equip's your AI agents & LLMs with 100+ high-quality integrations
assafelovic,gpt-researcher,https://github.com/assafelovic/gpt-researcher,Python,LLM based autonomous agent that conducts deep local and web research
AntonOsika,gpt-engineer,https://github.com/AntonOsika/gpt-engineer,Python,CLI platform to experiment with codegen
TransformerOptimus,SuperAGI,https://github.com/TransformerOptimus/SuperAGI,Python,<⚡️> SuperAGI - A dev-first open source autonomous AI agent framework
agno-agi,agno,https://github.com/agno-agi/agno,Python,"Full-stack framework for building Multi-Agent Systems with memory, knowledge and reasoning"
raga-ai-hub,RagaAI-Catalyst,https://github.com/raga-ai-hub/RagaAI-Catalyst,Python,"Python SDK for Agent AI Observability, Monitoring and Evaluation Framework"
Significant-Gravitas,AutoGPT,https://github.com/Significant-Gravitas/AutoGPT,Python,"AutoGPT is the vision of accessible AI for everyone, to use and to build on"
LAION-AI,Open-Assistant,https://github.com/LAION-AI/Open-Assistant,Python,OpenAssistant is a chat-based assistant that understands tasks
browser-use,browser-use,https://github.com/browser-use/browser-use,Python,🌐 Make websites accessible for AI agents. Automate tasks online with ease
OpenInterpreter,open-interpreter,https://github.com/OpenInterpreter/open-interpreter,Python,A natural language interface for computers
marimo-team,marimo,https://github.com/marimo-team/marimo,Python,A reactive notebook for Python — run reproducible experiments
deepset-ai,haystack,https://github.com/deepset-ai/haystack,Python,"AI orchestration framework to build customizable, production-ready LLM applications"
langflow-ai,langflow,https://github.com/langflow-ai/langflow,Python,Langflow is a low-code app builder for RAG and multi-agent AI applications
sympy,sympy,https://github.com/sympy/sympy,Python,A computer algebra system written in pure Python
Lightning-AI,pytorch-lightning,https://github.com/Lightning-AI/pytorch-lightning,Python,"Pretrain, finetune ANY AI model of ANY size on multiple GPUs, TPUs with zero code changes"
pytorch,pytorch,https://github.com/pytorch/pytorch,"Python, C++",Tensors and Dynamic neural networks in Python with strong GPU acceleration
keras-team,keras,https://github.com/keras-team/keras,Python,Deep Learning for humans
tensorflow,tensorflow,https://github.com/tensorflow/tensorflow,"C++, Python",An Open Source Machine Learning Framework for Everyone
jax-ml,jax,https://github.com/jax-ml/jax,Python,"Composable transformations of Python+NumPy programs: differentiate, vectorize, JIT to GPU/TPU"
dmlc,dgl,https://github.com/dmlc/dgl,Python,"Python package built to ease deep learning on graph, on top of existing DL frameworks"
cupy,cupy,https://github.com/cupy/cupy,"Python, C++",NumPy & SciPy for GPU
dask,dask,https://github.com/dask/dask,Python,Parallel computing with task scheduling
modin-project,modin,https://github.com/modin-project/modin,Python,Modin: Scale your Pandas workflows by changing a single line of code
networkx,networkx,https://github.com/networkx/networkx,Python,Network Analysis in Python
numba,numba,https://github.com/numba/numba,Python,NumPy aware dynamic Python compiler using LLVM
Theano,Theano,https://github.com/Theano/Theano,Python,"Theano was a Python library that allows you to define, optimize, and evaluate mathematical expressions"
optuna,optuna,https://github.com/optuna/optuna,Python,A hyperparameter optimization framework
facebook,prophet,https://github.com/facebook/prophet,"Python, R",Tool for producing high quality forecasts for time series data
facebookresearch,fairseq,https://github.com/facebookresearch/fairseq,Python,Facebook AI Research Sequence-to-Sequence Toolkit written in Python
mwaskom,seaborn,https://github.com/mwaskom/seaborn,Python,Statistical data visualization in Python
matplotlib,matplotlib,https://github.com/matplotlib/matplotlib,Python,matplotlib: plotting with Python
vega,altair,https://github.com/vega/altair,Python,Declarative visualization library for Python
pyecharts,pyecharts,https://github.com/pyecharts/pyecharts,Python,🎨 Python Echarts Plotting Library
statsmodels,statsmodels,https://github.com/statsmodels/statsmodels,Python,Statsmodels: statistical modeling and econometrics in Python
rougier,numpy-100,https://github.com/rougier/numpy-100,Python,100 numpy exercises (with solutions)
rougier,scientific-visualization-book,https://github.com/rougier/scientific-visualization-book,Python,An open access book on scientific visualization using python and matplotlib
MorvanZhou,tutorials,https://github.com/MorvanZhou/tutorials,Python,机器学习相关教程
DLR-RM,stable-baselines3,https://github.com/DLR-RM/stable-baselines3,Python,"PyTorch version of Stable Baselines, reliable implementations of reinforcement learning algorithms"
ShangtongZhang,reinforcement-learning-an-introduction,https://github.com/ShangtongZhang/reinforcement-learning-an-introduction,Python,Python Implementation of Reinforcement Learning: An Introduction
rushter,MLAlgorithms,https://github.com/rushter/MLAlgorithms,Python,Minimal and clean examples of machine learning algorithms implementations
allenai,allennlp,https://github.com/allenai/allennlp,Python,"An open-source NLP research library, built on PyTorch"
keon,algorithms,https://github.com/keon/algorithms,Python,Minimal examples of data structures and algorithms in Python
scrapy,scrapy,https://github.com/scrapy/scrapy,Python,"Scrapy, a fast high-level web crawling & scraping framework for Python"
binux,pyspider,https://github.com/binux/pyspider,Python,A Powerful Spider(Web Crawler) System in Python
seleniumbase,SeleniumBase,https://github.com/seleniumbase/SeleniumBase,Python,"Python APIs for web automation, testing, and bypassing bot-detection"
postmanlabs,httpbin,https://github.com/postmanlabs/httpbin,Python,"HTTP Request & Response Service, written in Python + Flask"
psf,requests-html,https://github.com/psf/requests-html,Python,Pythonic HTML Parsing for Humans™
wistbean,learn_python3_spider,https://github.com/wistbean/learn_python3_spider,Python,python爬虫教程系列、从0到1学习python爬虫
Jack-Cherish,python-spider,https://github.com/Jack-Cherish/python-spider,Python,🌈Python3网络爬虫实战：淘宝、京东、网易云、B站、12306、抖音等
shengqiangzhang,examples-of-web-crawlers,https://github.com/shengqiangzhang/examples-of-web-crawlers,Python,"一些非常有趣的python爬虫例子,对新手比较友好"
Kr1s77,awesome-python-login-model,https://github.com/Kr1s77/awesome-python-login-model,Python,😮python模拟登陆一些大型网站，还有一些简单的爬虫
twintproject,twint,https://github.com/twintproject/twint,Python,An advanced Twitter scraping & OSINT tool written in Python
injetlee,Python,https://github.com/injetlee/Python,Python,Python脚本。模拟登录知乎， 爬虫，操作excel，微信公众号，远程开机
